user_input,retrieved_contexts,response,reference,faithfulness,answer_relevancy
What is the NAV of Kotak Small Cap Fund?,"['Fund Name: Kotak Small Cap Fund. Net Asset Value (NAV): ₹263.99. Expense Ratio: 0.55%. Assets Under Management (AUM): ₹16,871 Cr. Minimum Lumpsum/SIP: ₹100 / ₹100. Lock-in Period: No Lock-in. Risk Level: Very High Risk. Benchmark: Nifty Smallcap 250 TR INR. Inception Date: 1 January, 2013. Exit Load: 1.0%.\n\nFund Name: Kotak Large Cap Fund. Net Asset Value (NAV): ₹606.21. Expense Ratio: 0.63%. Assets Under Management (AUM): ₹10,925 Cr. Minimum Lumpsum/SIP: ₹100 / ₹100. Lock-in Period: No Lock-in. Risk Level: Very High Risk. Benchmark: Nifty 100 TR INR. Inception Date: 1 January, 2013. Exit Load: 1.0%.']",The NAV of Kotak Small Cap Fund is ₹263.99.,₹263.99,,
What is the risk level of Kotak Midcap Fund?,"['Fund Name: Kotak Midcap Fund. Net Asset Value (NAV): ₹145.04. Expense Ratio: 0.38%. Assets Under Management (AUM): ₹61,694 Cr. Minimum Lumpsum/SIP: ₹100 / ₹100. Lock-in Period: No Lock-in. Risk Level: Very High Risk. Benchmark: Nifty Midcap 150 TR INR. Inception Date: 1 January, 2013. Exit Load: 1.0%.\n\nFund Name: Kotak Multicap Fund. Net Asset Value (NAV): ₹19.11. Expense Ratio: 0.45%. Assets Under Management (AUM): ₹23,886 Cr. Minimum Lumpsum/SIP: ₹100 / ₹100. Lock-in Period: No Lock-in. Risk Level: Very High Risk. Benchmark: Nifty 500 Multicap 50:25:25 TR INR. Inception Date: 29 September, 2021. Exit Load: 1.0%.']",The risk level of Kotak Midcap Fund is Very High Risk.,Very High Risk,,
What is the benchmark for Kotak Large Cap Fund?,"['Fund Name: Kotak Large Cap Fund. Net Asset Value (NAV): ₹606.21. Expense Ratio: 0.63%. Assets Under Management (AUM): ₹10,925 Cr. Minimum Lumpsum/SIP: ₹100 / ₹100. Lock-in Period: No Lock-in. Risk Level: Very High Risk. Benchmark: Nifty 100 TR INR. Inception Date: 1 January, 2013. Exit Load: 1.0%.\n\nFund Name: Kotak Small Cap Fund. Net Asset Value (NAV): ₹263.99. Expense Ratio: 0.55%. Assets Under Management (AUM): ₹16,871 Cr. Minimum Lumpsum/SIP: ₹100 / ₹100. Lock-in Period: No Lock-in. Risk Level: Very High Risk. Benchmark: Nifty Smallcap 250 TR INR. Inception Date: 1 January, 2013. Exit Load: 1.0%.']",The benchmark for Kotak Large Cap Fund is Nifty 100 TR INR.,Nifty 100 TR INR,,
Is there a lock-in period for Kotak ELSS Tax Saver Scheme Fund?,"['Fund Name: Kotak ELSS Tax Saver Scheme Fund. Net Asset Value (NAV): ₹122.98. Expense Ratio: 0.62%. Assets Under Management (AUM): ₹6,355 Cr. Minimum Lumpsum/SIP: ₹500 / ₹500. Lock-in Period: 3 Years. Risk Level: Very High Risk. Benchmark: Nifty 500 TR INR. Inception Date: 1 January, 2013. Exit Load: 0%.\n\nFund Name: Kotak Large Cap Fund. Net Asset Value (NAV): ₹606.21. Expense Ratio: 0.63%. Assets Under Management (AUM): ₹10,925 Cr. Minimum Lumpsum/SIP: ₹100 / ₹100. Lock-in Period: No Lock-in. Risk Level: Very High Risk. Benchmark: Nifty 100 TR INR. Inception Date: 1 January, 2013. Exit Load: 1.0%.']","Yes, the Kotak ELSS Tax Saver Scheme Fund has a lock-in period of 3 Years.",3 Years,,
What is the expense ratio of Kotak Multicap Fund?,"['Fund Name: Kotak Multicap Fund. Net Asset Value (NAV): ₹19.11. Expense Ratio: 0.45%. Assets Under Management (AUM): ₹23,886 Cr. Minimum Lumpsum/SIP: ₹100 / ₹100. Lock-in Period: No Lock-in. Risk Level: Very High Risk. Benchmark: Nifty 500 Multicap 50:25:25 TR INR. Inception Date: 29 September, 2021. Exit Load: 1.0%.\n\nFund Name: Kotak Midcap Fund. Net Asset Value (NAV): ₹145.04. Expense Ratio: 0.38%. Assets Under Management (AUM): ₹61,694 Cr. Minimum Lumpsum/SIP: ₹100 / ₹100. Lock-in Period: No Lock-in. Risk Level: Very High Risk. Benchmark: Nifty Midcap 150 TR INR. Inception Date: 1 January, 2013. Exit Load: 1.0%.']",The expense ratio of Kotak Multicap Fund is 0.45%.,0.45%,,
